{
  "formatVersion": "1.0",
  "trackId": "track-01",
  "chapterId": "chapter-01",
  "durationMs": 2000,
  "segments": [
    { "segmentId": "seg-01-01", "startMs": 0, "endMs": 650, "text": "第一章", "blockId": "c01-title", "startChar": 0, "endChar": 3 },
    { "segmentId": "seg-01-02", "startMs": 800, "endMs": 2000, "text": "你好，离线听读。", "blockId": "c01-p01", "startChar": 0, "endChar": 8 }
  ]
}

